{
  "spec": {
    "name": "OND-ART",
    "version": "0.1",
    "profile": "core"
  },
  "run": {
    "run_id": "2026-02-03T12:00:00+00:00#demo-nodisclaimer",
    "created_at": "2026-02-03T12:00:00+00:00",
    "timezone": "America/New_York"
  },
  "context": {
    "protocol": "signature",
    "scheme": "ECDSA-P256",
    "params": {
      "hash": "SHA-256"
    },
    "public_context_hash": "sha256:deadbeef"
  },
  "data": {
    "N": 10000,
    "order": "generation_index",
    "message_policy": "fixed-set-v1",
    "invalid_count": 0
  },
  "pi": {
    "pi_id": "ecdsa-ur-uz-v1",
    "pi_version": "1.0.0",
    "pi_spec_hash": "sha256:cafebabe",
    "obs_space": {
      "type": "R^d",
      "d": 2
    }
  },
  "bootstrap": {
    "B": 200,
    "method": "percentile",
    "unit": "U",
    "block_length": 0
  },
  "metrics": {
    "rank": {
      "H": 0.65,
      "rho": 0.94,
      "ci95": [
        0.92,
        0.95
      ],
      "svd_settings": {
        "eps": 1e-12
      }
    },
    "subspace": {
      "H": 5.1,
      "rho": 0.71,
      "ci95": [
        0.68,
        0.74
      ],
      "binning": {
        "b": 8,
        "M_occ": 512
      }
    },
    "branching": {
      "H": 1.85,
      "ci95": [
        1.78,
        1.92
      ],
      "clustering": {
        "method": "kmeans",
        "K": 316,
        "seed": 0
      }
    }
  },
  "baseline": null,
  "notes": [
    "Demo report without standard disclaimer."
  ]
}
